{
  "contractVersion": "agent-history-v1",
  "schemaVersion": 1,
  "operation": "locateSession",
  "backend": {
    "kind": "local",
    "dataRoot": "/tmp/ctx-sdk-fixture"
  },
  "location": {
    "ctxSessionId": "22222222-2222-4222-8222-222222222222",
    "provider": "codex",
    "providerSessionId": "codex-fixture-session",
    "source": {
      "path": "/tmp/ctx-sdk-fixture/session.jsonl",
      "cursor": "session:codex-fixture-session",
      "exists": true,
      "sourceId": "33333333-3333-4333-8333-333333333333",
      "sourceFormat": "codex_session_jsonl"
    },
    "resume": {
      "providerSessionId": "codex-fixture-session"
    }
  }
}
