{
  "contractVersion": "agent-history-v1",
  "schemaVersion": 1,
  "operation": "sync",
  "backend": {
    "kind": "local",
    "dataRoot": "/tmp/ctx-sdk-fixture"
  },
  "import": {
    "resume": true,
    "resumeMode": "incremental",
    "totals": {
      "sourceFiles": 1,
      "sourceBytes": 2048,
      "importedSources": 1,
      "failedSources": 0,
      "importedSessions": 0,
      "importedEvents": 1,
      "importedEdges": 0,
      "skipped": 1,
      "failed": 0
    },
    "sources": []
  }
}
